index,source,edge,target,edge-comments
1,American Medical Association,voted to,end personal exemptions,personal vaccination exemptions
2,American Medical Association,is the country's largest association of,physicians,
3,American Medical Association,supports on both state and federal levels to,end personal exemptions,
4,American Medical Association,persuaded to end personal exemptions,state legislatures,
5,state legislatures,American Medical Association members persuaded to,end personal exemptions,
6,American Medical Association,members voted to eliminate,nonmedical reasons for exemptions,
7,nonmedical reasons for exemption,such as,religion,religious reasons
8,religion,is used to dodge crucial,immunization,
9,measles,is crucial,immunization,
10,religion,is used to dodge crucial immunizations against diseases such as,measles,
11,religion,is used to dodge crucial immunizations against diseases such as,whooping cough,
12,whooping cough,is crucial,immunization,
13,community health,protecting it requires,policy makers,
14,policy makers,should not permit individuals from,opting out of immunization,solely as a matter of personal preference
15,opting out of immunization,should not be solely as a matter of,personal preference,
16,Disneyland measles outbreak,occurred because of,vaccine exemptions,
17,immunized people,help prevent the,spread of disease,"said board member Dr. Patrice Harris, according to Forbes"
18,Disneyland measles outbreak,"117 people in Orange County, California were infected by",highly contagious disease,
19,states,others also reported,measles outbreak,
20,vaccine debate,was revived about,vaccine safety,
21,right to personal exemptions,quickly became lightening rod of,controversy,
22,right to personal exemptions,controversy extended to potential,presidential candidates,
23,presidential candidates,were asked for their position in,vaccine debate,
24,Senator Rand Paul,said,vaccinations should be voluntary,
25,Senator Rand Paul,suggested immunization could lead to profound,mental disorders,
26,vaccinations,should be,voluntary,
27,vaccinations,could lead to profound,mental disorders,
28,Hilary Clinton,took a firmer stance than she had in previous years by supporting,vaccination,
29,vaccinations,remain contentious,state-level issue,
30,vaccinations,are a,no brainer,said AMA member Dr. James Felsen
31,vaccinations,said AMA member Dr. James Felsen,protect the kid next to you,
32,Vaccine Free Family Day Care,is,anti-vaccine group,"in Dromana, Victoria, Australia"
33,Early Childhood Australia,is,early childcare advocacy group,in Australia
34,federal government,is implementing in Australia,"no jab, no pay policy",
35,parents,are opening,vaccine-free day care centres,"in response to Australian federal government's no jab, no pay policy"
36,parents,are opening,unvaccinated-friendly day care centres,"in response to Australian federal government's no jab, no pay policy"
37,vaccine-free day care centres,are,unvaccinated-friendly day care centres,
38,vaccine-free day care centres,have been described as potentially catastrophic by,Early Childhood Australia,
39,unvaccinated-friendly day care centres,have been described as potentially catastrophic by,Early Childhood Australia,
40,Scott Morrison,is,Australian social services minister,
41,parents who refuse to vaccinate their children,are,conscientious objectors,says Scott Morrison
42,parents who refuse to vaccinate their children,would no longer receive,tax benefits,in Australia
43,parents who refuse to vaccinate their children,would no longer receive,childcare benefits,
44,parents who refuse to vaccinate their children,would no longer receive,childcare rebate,
45,parents who refuse to vaccinate their children,would no longer receive,family tax benefit,part A end-of-year supplement
46,parents,are being denied,childcare,due to their child's vaccination status
47,unvaccinated-friendly day care centres,lady is opening in,"Sydney, Australia",
48,children,all should have an equal chance at,early education,says lady opening unvaccinated-friendly day care centres
49,unvaccinated children,still would not qualify for,government rebates,in Australia
50,vaccine-free day care centres,provide a,non-judgmental environment,
51,Samantha Page,is,Early Childhood Australia's chief executive,
52,parents who refuse to vaccinate their children,are being driven away by,government policy,
53,government policy,would provide less opportunity to engage with,parents who refuse to vaccinate their children,feared Samantha Page
54,one child,if there's a bulk of children unvaccinated then it is potentially catastrophic,whooping cough,said Samantha Page
55,unvaccinated children,has been a concern to some providers for some time because diseases pose,risk to pregnant women,as a lot of women work in the industry
56,regulation of childcare services,was responsibility of,state and territory governments,
57,parents,"if choose to send their children to a service which is not subject to any regulation, need to be aware of the",potential risks,Morrisson said
58,Jill Hennessy,is,Victoria's health minister,
59,vaccine-free day care centres,is irresponsible said,Jill Hennessy,
60,parents,are urged against sending their children to,vaccine-free day care centre,Jill Hennessy urged
61,Victorian government,requires,vaccinated children,
62,vaccinated children,can be enrolled in,childcare,
63,hesitant parents,can be nudged to use,measles vaccine,
64,measles vaccine coverage,for hesitant parents should try,small nudges,
65,measles protection,rests on,herd immunity,powerful
66,herd immunity,requires,92 to 94 percent vaccination coverage,for measles
67,herd immunity,is 92 to 94 percent of people in a community that must be vaccinated to prevent,measles outbreak,
68,measles,killed more around the world in 2013,children,than car accidents
69,measles,killed more around the world in 2013,children,than AIDS
70,measles virus,"has trouble finding victims, even the unvaccinated at",herd immunity,that immunization level
71,measles virus,has trouble finding,victims,
72,measles virus,has trouble finding,unvaccinated,
73,measles virus ,shown by,measles experience,
74,measles virus,shown by,models of disease,
75,Libya,has 99 percent,measles vaccination rate,
76,Tanzania,has 99 percent,measles vaccination rate,
77,Libya,has passed,92 to 94 percent vaccination coverage,
78,Tanzania,has passed,92 to 94 percent vaccination coverage,
79,United States,has not passed,92 to 94 percent vaccination coverage,
80,United States,vaccination coverage dragged down by,parents who refuse to vaccinate their children,
81,parents who refuse to vaccinate their children,in the U.S. have not,met the bar,previously stated vaccination coverage
82,measles vaccination rate,coverage is as low as 86%,Colorado,
83,measles vaccination rate,coverage is as low as 86%,Ohio,
84,Colorado,has,86% vaccination coverage,
85,Ohio,has,86% vaccination coverage,
86,86% vaccination coverage,is,low vaccination coverage,
87,measles vaccination rate,the national average is 91 percent,United States,
88,low vaccination coverage,"in 2014, caused 644 people in the U.S. to be sickened by",measles,more than in any year since 2000
89,policy makers,some have called for new,laws requiring MMR vaccination,for all school-age children
90,policy makers,some have called for,vaccine mandates,new laws
91,Americans,most would support,vaccine mandates,"Eight out of 10 Americans would support such laws, one CNN poll found"
92,vaccine mandates,are,strong-arm tactics,
93,vaccine mandates,would probably,backfire,
94,vaccine mandates,would probably reinforce the,antivaccine movement,
95,antivaccine movement,is driven by fears that shots cause,autism,
96,antivaccine movement,is driven by fears that shots cause autism and other,side effects,
97,antivaccine movement,is driven by,fear of vaccine-autism link,
98,behavioral science research,highlights a better way to change other,parents' hesitant attitudes,
99,parents' hesitant attitudes,a better way is to change with,little nudges,
100,parents who vehemently oppose vaccines,become even less likely to vaccinate when confronted by insistence on,vaccine safety,researchers have found
101,parents who vehemently oppose vaccines,Fortunately make up only about 9 percent of,adults,according to Gallup poll
102,vaccine-autism link,usually stems from,Wakefield study,fraudulent and retracted 1998 Lancet study
103,Wakefield study,was fraudulent and,retracted 1998 Lancet study,
104,parents,many more do not vaccinate their kids because they are just unsure about,vaccine-autism link,
105,adults,most have not made up their mind about,vaccine-autism link,
106,fence-sitters,are unsure about,vaccine-autism link,
107,fence-sitters,are,hesitant parents,
108,fence-sitters,could be prodded toward getting,vaccines,
109,pediatricians,are one of the most important,vaccine information sources,
110,pediatricians,are the best route to reach,hesitant parents,
111,vaccine refusal rates,increase when,doctors,do not stand strongly behind vaccines
112,vaccines,when presented as,vague choice,rather than standard of care increased odds of parental refusal 2013 Pediatrics study
113,parents,more likely to go through with it when informing them their child would receive vaccine at their next,scheduled appointment,than if they were merely asked which vaccines they wanted their child to receive
114,parents,some (roughly 23 percent of reluctant group) have,distrust of medical establishment,
115,distrust of medical establishment,fuels,vaccine hesitancy,
116,friends,recruiting to pass on the message could be more effective for,parents,whose distrust of the medical establishment fuesl hesitancy about vaccines
117,peers,recruiting to pass on the message could be more effective for,parents,whose distrust of the medical establishment fuesl hesitancy about vaccines
118,peer pressure,is strongest influence on,decision to vaccinate,scientists reported in 2014 Proceedings of the Royal Society B
119,social norms,is strongest influence on,decision to vaccinate,
120,flu shots,are not as controversial as,MMR shots,comparison
121,important factor,is the,change in compliance,
122,states,begin implementing such,interventions,
123,states,search for,new strategies,if
124,interventions,can push past,herd immunity,
125,new strategies,can push past,herd immunity,
126,we,will fail to prevent a very,preventable disease,otherwise
127,Washington State public-private pilot program,trains,pro-vaccine parents,to be community advocates
128,pro-vaccine parents,are trained to be,community advocates,
129,pro-vaccine parents,spread,vaccine message,pro-vaccine message
130,vaccine message,spread on,social media,
131,vaccine message,spread by speaking directly to,neighbors,
132,vaccine message,spread at,schools,
133,vaccine message,spread at,community events,
134,fence sitters,could be encouraged to vaccinate by asking to,make plans ahead of time,
135,employees,were more likely to get flu shot when prompting to write down,date and time for shot,2011 study at midwestern utilities firm
136,date and time for shot,should be,written down,2011 study at midwestern utilities firm
137,flu shots,not as controversial as,MMR shots,
138,measles,is very,preventable disease,
139,teen girls,are receiving important health benefits from,HPV vaccine,
140,teen girls,are receiving important,health benefits,
141,risk of precancerous changed,dropped after,immunization,
142,sexually transmitted virus,causes,cervical cancer,
143,HPV vaccine,protects against,sexually transmitted virus,
144,HPV vaccine,protects against,cervical cancer,
145,vaccine,teen girls who received experienced reduction in,cervical dysplasia,
146,vaccine,teen girls who received suffered fewer cases,genital warts,
147,genital warts,can happen as soon as girl becomes,sexually active,
148,cervical dysplasia,can happen as soon as girl becomes,sexually active,
149,parents,have been delaying vaccination for,daughters,
150,parents,don't think daughters are,sexually active,
151,ages 14 to 17,are,sexually active,
152,sexually active,ages 14 to 17 are,at risk,
153,HPV vaccine,needs to be given before,at risk,
154,HPV vaccine,is recommended,ages 11 or 12,
155,HPV vaccine,is recommended,boys,
156,HPV vaccine,is recommended,girls,
157,HPV vaccination rates,continued to lag in,U.S.,
158,HPV vaccine,is about,preventing cancer,
159,women,only about half have received,one dose of vaccine,
160,women,just a third have received,three-dose course,
161,HPV vaccine,can prevent,cancer,
162,parents,are not running to get kids,protection,
163,cervical dysplasia,tends to be earliest signs of,HPV infection,
164,genital warts,tends to be earliest signs of,HPV infection,
165,protection,girls receive with a few years of inoculation with,HPV vaccine,
166,cervical dysplasia,if left untreated and unchecked,becomes cancer,
167,risk of cervical dysplasia,reduced by 44% for girls who received,vaccine,
168,genital warts,fewer cases in girls eligible for free,HPV vaccine,
169,teen girls,eligible for free HPV vaccine ended up with fewer cases of,genital warts,
170,magnitude of benefits,is surprising in,young age group,
171,HPV vaccine,has,magnitude of benefits,
172,health officials,recommend,HPV vaccine,at age 11 or 12
173,Tdap,is,tetanus/diptheria/pertussis,
174,Tdap,is other,important vaccine,
175,HPV vaccine,given at same time as other important vaccines,Tdap,tetanus/diptheria/pertussis
176,HPV vaccine,given at same time as other important vaccines,meningitis,
177,meningitis,is,important vaccine,
178,Gardasil 4,protects against 4 strains,human papillomavirus,HPV
179,Cervarix,protects against 2 strains,human papillomavirus,HPV
180,Gardasil 9,protects against 9 strains,human papillomavirus,HPV
181,parents,many are hung up on fact that vaccine is for,sexually transmitted virus,
182,health care providers,many are hung up on fact that vaccine is for,sexually transmitted virus,
183,parents,fail to grasp that HPV vaccine is first to,prevent cancer,
184,health care providers,fail to grasp that HPV vaccine is first to,prevent cancer,
185,waiting longer,could mean less potent,immune response,
186,waiting longer,leads to less effective,protection,
187,immune response,could be less potent after waiting longer to get,vaccine,
188,immune response,if less potent leads to less effective,protection,
189,HPV vaccine,let's not make it about,sex,
190,HPV vaccine,is about,preventing cancer,
191,HPV vaccine,has,benefits,
192,HPV vaccine benefits,can be seen in,high school girls,
193,HPV vaccine,prevents,cervical cancer,in women
194,HPV vaccine,protection against,genital warts,in women
195,HPV vaccine,protection against,cervical dysplasia,in women
196,high school girls who received Gardasil,were less likely than those unvaccinated to be diagnosed with,cervical dysplasia,three doses
197,Gardasil,appeared to reduce risk of,genital warts,
198,Gardasil,billed as vaccine against,cervical cancer,
199,cervical cancer,typically strikes in 40s or 50s,women,
200,CDC,recommends girls get vaccinated when 11 or 12,Gardasil,when 11 or 12
201,CDC,recommends boys get vaccinated when 11 or 12,Gardasil,when 11 or 12
202,girls,should get vaccinated with,Gardasil,when 11 or 12
203,boys,should get vaccinated with,Gardasil,when 11 or 12
204,girls,should get vaccinated with Gardasil before exposed to,HPV,CDC recommends
205,boys,should get vaccinated with Gardasil before exposed to,HPV,CDC recommends
206,girls,should get vaccinated with Gardasil before,sexually active,CDC recommends
207,boys,should get vaccinated with Gardasil before,sexually active,CDC recommends
208,parents,many have no sense of urgency about,Gardasil,
209,parents,many have no,sense of urgency,about Gardasil
210,girls,only 57% between ages 13 and 17 had received,one dose Gardasil,CDC report
211,girls,only 38% between ages 13 and 17 had received,three doses Gardasil,CDC report
212,parents,believe no harm in,delaying Gardasil,researchers say
213,parents,are putting at risk,daughters' health,researchers say
214,delaying Gardasil,puts at risk,daughters' health,
215,Gardasil,targets four main,HPV strains,
216,Gardasil,can prevent,variety of medical conditions,
217,variety of medical conditions,some may lead to,cervical cancer,
218,protection,from Gardasil kicks in,fast,study results show
219,HPV vaccine benefits,observed in,young age group,strengthens vaccination recommendations
220,HPV vaccine benefits,strengthens,vaccination recommendations,
221,vaccinated,few girls vaccinated if not eligible for,free vaccine,
222,free vaccine eligible girls,even if eligible on 50.6% got,three doses Gardasil,
223,cervical dysplasia,characterized by,abnormal cells,
224,cervical dysplasia,can lead to,cervical cancer,
225,vaccinated girls,5.7 fewer cases per 1000,cervical dysplasia,than unvaccinated girls
226,free vaccine eligible girls,2.32 fewer cases,cervical dysplasia,than non-free vaccine eligible girls
227,cervical dysplasia,one case averted for every 175,vaccinated girls,
228,genital warts,also caused by,HPV,
229,free vaccine eligible girls,.34 fewer cases,genital warts,than non-free vaccine eligible girls
230,vaccinated girls,.83 fewer cases,genital warts,than unvaccinated girls
231,strong evidence,of,positive health impact,
232,positive health impact,of,Gardasil vaccine,on teens
233,Cervarix,similar to,Gardasil,
234,Cervarix,approved for use in United States targets two,HPV strains,
235,new version of Gardasil,similar to,Gardasil,
236,new version of Gardasil,approved for use in,United States,
237,new version of Gardasil,targets nine,HPV strains,
238,policy makers,can use findings to substantiate arguments against,delaying vaccination,
239,physicians,can use findings to substantiate arguments against,delaying vaccination,
240,delaying vaccination,may result in missed,prevention opportunities,study authors concluded
241,vaccines,scientifically proven to be best way to prevent the,spread of communicable diseases,
242,families,in Arizona are choosing,choosing not to vaccinate children,in Arizona
243,families,in Arizona number is increasing,choosing not to vaccinate children,in Arizona
244,families,in the US number is increasing,choosing not to vaccinate children,in the U.S.
245,Disneyland outbreak,created a firestorm of,interest in vaccinations,
246,Disneyland outbreak,produced largest number of cases since considered eliminated,measles,
247,parents,can choose to exempt their children from required childcare and school vaccinations for,personal beliefs,in Arizona
248,parents,can choose to exempt their children from required childcare and school vaccinations for,religious reasons,in Arizona
249,parents,can choose to exempt their children from required childcare and school vaccinations for,medical exemption,in Arizona
250,children,can be exempted from,required vaccinations,
251,required vaccinations,can be exempt for,personal belief reasons,
252,required vaccinations,can be exempt for,religious reasons,
253,required vaccinations,can be exempt if child has,medical issue,
254,exemption rates,went down in Arizona for 2014-2015 in,childcare,
255,exemption rates,went down in Arizona for 2014-2015 in,kindergarten,
256,medical issue,can make dangerous,vaccination,
257,decrease in exemption rates,is,good news,
258,decrease in exemption rates,might be,fluke,
259,decrease in exemption rates,may be,change in mindset of families,
260,Arizona Deparment of Health Services,hopes will continue next year,decrease in exemption rates,the trend
261,decrease in exemption rates,if continues may be due to,Arizona Department of Health Services,
262,decrease in exemption rates,if continues may be due to,concerns,
263,public health,will keep watching and working to help our state reach ,herd immunity,against all vaccine-preventable diseases
264,National Infant Immunization Week,highlight importance of protecting,infants,from vaccine-preventable diseases
265,National Infant Immunization Week,celebrate achievements,immunization programs,
266,Dr. Bill Adams,"is an advocate, educator, champion for",preventive health,"champion for preventive health, educator"
267,vaccines,are successful,public health tools,
268,vaccines,are cost-effective,public health tools,
269,vaccines,help protect,vaccinated individuals,
270,vaccines,help protect,entire communities,
271,vaccines,prevent,spread of infectious diseases,
272,vaccines,reduce,spread of infectious diseases,
273,vaccination,will prevent,illnesses,
274,vaccination,will prevent,hospitalizations,
275,vaccination,will prevent,deaths,
276,vaccinating,is best way to protect by age 2 from,serious childhood diseases,14 serious childhood diseases
277,serious childhood diseases,like,whooping cough,
278,serious childhood diseases,like,measles,
279,diseases,can be especially serious,young children,
280,immunization schedule,is important to follow to protect,young children,
281,immunization schedule,provides in life,early immunity,
282,babies,can be protected before they are born from,whooping cough,
283,whooping cough,is an example,serious childhood diseases,
284,pregnant women,recommended to receive,Tdap vaccine,
285,Tdap vaccine,help protects baby from whooping cough for ,pregnant women,
286,Tdap vaccine,encouraged before meeting,baby,
287,Tdap vaccine,encouraged,parents,
288,Tdap vaccine,encouraged,caregivers,
289,Tdap vaccine,encouraged,close contacts,
290,parents,have not heard of today's vaccines because of,vaccine success,
291,polio,example of great impact in U.S.,vaccines,
292,polio,was America's most feared,disease,
293,polio,no reports in U.S. thanks to,vaccination,
294,vaccine-preventable diseases,still circulate around,U.S.,
295,vaccination,neccesary to protect everyone from,potential outbreaks,
296,rare diseases,are,transmitted around the world,
297,measles increase,is an example of seriousness of,vaccine-preventable diseases,
298,California,largest outbreak,measles,
299,immunization,is a shared,responsibility,
300,Babies,should receive,recommended immunizations,by age of 2
301,infants,should follow,recommended immunization schedule,
302,Children,should follow,recommended immunization schedule,
303,Pregnant women,during third trimester should recieve,Tdap vaccine,
304,Babies at 2 months,can recieve first,whooping couch vaccine,
305,Vaccines,in U.S. have eliminated,Polio,
306,Immunization programs,promotes,healthy communities,
307,Department of Public Health Immunization Program,is proud to announce selection of as Centers for Disease Control and Prevention Childhood Immunization Champion for Massachusetts,Dr. Bill Adams,
308,Dr. Adams,is an advocate for,improved immunization policy and funding,Massachusetts
309,Dr. Adams,is an educator for,parents,
310,Dr. Adams,is an educator for,physicians,
311,Dr. Adams,is an educator for,policy makers,
312,Vaccines,among children born during 1994-2013 will prevent 322 million ,illnesses,
313,Vaccination,among children born during 1994-2013 will prevent 21 million,hospitalizations,
314,infants,are later exposed to,life-threatening diseases,
315,Parents,are encouraged to talk to,child's doctor,to ensure that their baby is up-to-date on immunizations
316,vaccination of pregnant women,helps protect from whooping cough,baby,until baby is vaccinated at 2 months
317,Caregivers,parents should encourage to receive,Tdap vaccine,at least 2 weeks before meeting baby
318,Close contacts,parents should encourage to receive,Tdap vaccine,at least 2 weeks before meeting baby
319,Vaccines,have been succesful in,preventing disease,
320,Families,must work to help protect entire,community,
321,Healthcare professionals,must work to help protect entire,community,
322,Public health officials,must work to help protect entire,community,
323,Programs,in Massachusetts are working to insure,high immunization rates,
324,Partners,in Massachusetts are working to insure,high immunization rates,
325,vaccines,prevent dangerous or even deadly,diseases,
326,vaccines,reduce the,risk of infection,
327,vaccines,work with the body's,natural defenses,
328,vaccines,help the body safely develop,immunity,
329,vaccines,help develop imminty by imitating an,infection,
330,vaccines,do not cause,illness,
331,vaccines,cause the immune system to develop the same response as it does to a real,infection,so that the body can recognize and fight the vaccine-preventable disease in the future
332,vaccine,sometimes the imitation infection can cause,minor symptoms,
333,minor symptoms,are normal and should be expected as the body builds,immunity,
334,vaccines,help body safely develop,immunity to diseases,
335,vaccines,help develop,immunity,
336,imitation infection,does not cause,illness,
337,imitation infection,causes to develp same response as to real infection,immune system,
338,body,can recognize and fight in future,VPD,
339,minor symptoms,such as,fever,
340,minor symptoms,are,normal,
341,minor symptoms,should be,expected,
342,MMR vaccine,no evidence it raises,autism risk,april 21 issue of J of Am Med Assoc
343,children at increased genetic risk,no evidence it raises,autism risk,
344,no evidence,MMR vaccine raises,autism risk,
345,MMR vaccine-autism link,roots of theory in,Wakefield study,
346,Wakefield study,later found to be,fraudulent,
347,numerous international studies,have found no evidence for,MMR vaccine-autism link,
348,parents,still some remain,worried,
349,parents,who already have a child with autism seem even more concerned,child with autism,parents of kids with ASD
350,Jain study,finds no,vaccine-autism link,
351,autism,no increased risk even among,children at increased genetic risk,
