index,source,edge,target,edge-comments
1,7-11 year olds,whooping cough is shifting to from,adolescents,
2,7-11 year olds,reporting largest cases of,pertussis,
3,acellular pertussis vaccine,was,artifical vaccine,
4,acellular pertussis vaccine,used artifically created components of,bacteria,
5,acellular pertussis vaccine,still high,vaccine efficacy,Gambhir says
6,acellular pertussis vaccine,level of protection is lower than,whole-cell vaccine,
7,acellular pertussis vaccine,has lower coverage than,whole-cell vaccine,
8,acellular pertussis vaccine,for young children replaced the whole-virus,Tdap vaccine,in 1997
9,aluminum,in vaccines linked to,neurological disorders,
10,alzheimer's,since the 1980s has,significantly increased,
11,amendment,proposed by,committee members,
12,amendment,would have retained existing,religious exemptions,
13,Andrew Wakefield,set off the movement,anti-vaccination,
14,Andrew Wakefield,was,discredited,
15,Andrew Wakefield,lost his,medical license,
16,Andrew Wakefield,is former British doctor and co-author of discredited 1998 paper that claimed,vaccine-autism link,MMR
17,anti-vaccination,voices boosted by,celebrities,
18,anti-vaccination,because you disagree with,government mandate,forcing you to do something
19,anti-vaccination,voices boosted by celebrities like,Jenny McCarthy,
20,anti-vaccination,because you have good faith,medical belief,that vaccination caused condition
21,anti-vaccination,label is horrible,misrepresentation,for families who actually have vaccine-injured children
22,anti-vaccination,movement set off by idea that MMR vaccine responsible for,vaccine-autism link,MMR
23,anti-vaccination,movement has associated,negative perception,said Renee Gentry
24,anti-vaccination,movement has made it difficult to have,open conversations,said Renee Gentry
25,anti-vaccination,some are for,the sake of being anti-vaccine,
26,anti-vaccination,movement has made it difficult to have open conversations about real,vaccine risks,said Renee Gentry
27,anti-vaccination,label is horrible misrepresentation for families who actually have,vaccine-injured children,said Drew Downing
28,anti-vaccination,voices have made it difficult for,vaccine-injured children,those who have seen the real but rare side effects of vaccines
29,anti-vaccination,movement began in late 1990s after publication of now retracted,Wakefield study,
30,anti-vaxx movement,is,anti-vaccination,
31,anti-vaxxers,are,anti-vaccination,
32,anti-vaxxers,are,crazy people,
33,artificial vaccine,is behind an increase in cases of deadly,disease,
34,artificial vaccine,believed to generate,immune response,
35,asthma,since the 1980s has significantly,increased,
36,autism,apparent increase of 60% of cases is due to changes in criteria for,diagnosis,"according to CBS News, recent study by Danish researchers"
37,autism,apparent increase of 60% of cases is due to,inclusion of out-of-hospital diagnoses,"according to CBS News, recent study by Danish researchers"
38,autism,since the 1980s has significantly,increased,
39,Barry Segal,created,Focus for Health,
40,Ben Allen,altered SB 277 to make it possible for multiple families to join in,home-school,
41,Ben Allen,altered SB 277 with,proposed restrictions,to make it possible for multiple families to join in home-schooling unvaccinated children
42,Ben Allen,thinks it won't reach everyone,SB 277,Ben Allen told education committee
43,Ben Allen,thinks it will increase safety,SB 277,Ben Allen told education committee
44,CDC,do not recommend any shift in protocols for,vaccination,
45,Chairwoman Carol Liu,voiced similar,concerns,to parents and children
46,Chairwoman Carol Liu,voted for,SB 277,even though she said it has a long way to go to fully address her concerns
47,children,worried SB 277 would deprive young people of right to an,education,
48,children,get five-dose series of,pertussis vaccine,in the U.S.
49,children,many testified against proposal for,SB 277,
50,children,worried,SB 277,would deprive young people of right to an education
51,children,exempted from,state-required vaccinations,
52,children,said they didn't believe in,vaccine safety,
53,Chris Christie,expected to run for 2016,president,
54,Chris Christie,is,Republican,
55,Chris Christie,called for some measure of choice on vaccines by parents,vaccine choice,NJ Governor
56,clusters,of people who refuse vaccine cannot account for,rise,in disease
57,Connie Leyva,concerned SB 277 will not go far enough to help,low-income family,who can't home-school
58,Connie Leyva,voted against,SB 277,
59,Connie Leyva,concerned SB 277 will not go far enough to help,single working parent,who can't home-school
60,debate,in media over,vaccination,says Gambhir
61,Dr. Anna Acosta,"study findings published online May 4 in journal Pediatrics, is an epidemiologist",CDC,
62,Dr. Anna Acosta,conducted research on,decreasing effectiveness,of pertussis booster
63,Dr. Paul Offit,is chief of infectious diseases at,Children's Hospital of Philadelphia,
64,Dr. Paul Offit,says we need an improved,pertussis vaccine,
65,Dr. Paul Offit,expressed little surprise at the notion of Tdap,waning effectiveness,
66,Drew Downing,is Phoenix,lawyer,who specializes in vaccine injury cases
67,Dwoskin Family Foundation,started by,Alfred and Lisa Claire Dwoskin,
68,Dwoskin Family Foundation,has funded efforts focused on finding in children and older adults the causes of,cognitive disorders,
69,Dwoskin Family Foundation,has funded efforts focused on finding in children and older adults the causes of,immune disorders,
70,Dwoskin Family Foundation,has funded efforts focused on finding in children and older adults the causes of,inflammatory disorders,
71,Dwoskin Family Foundation,"donated $950,000 towards some research looking at potential",vaccine-autism link,link between aluminum in vaccines and neurological disorders
72,Dwoskin Family Foundation,"has donated $263,000 to",National Vaccine Information Center,
73,Dwoskin Family Foundation,"donated $950,000 to",University of British Columbia,
74,Dwoskin Family Foundation,put money into a film that suggested,vaccines cause childhood illnesses,
75,elderly,have,reduced immunity,
76,fair balance,provides more,options,to parents concerned about vaccinating
77,findings,highlight the need to similar,research,
78,Focus for Health,"is dedicated to advocacy, education, investigation and research that explores epidemic of",autism,
79,Focus for Health,"is dedicated to advocacy, education, investigation and research that explores",chronic illness,
80,Focus for Health,"donated $171,000 to",Generation Rescue,
81,Gambhir study,suggests further doses,booster,
82,Gambhir study,suggests changes to pertussis,vaccination schedule,
83,Gambhir study,did not find drop in overall level in U.S.,pertussis vaccination,
84,Generation Rescue,has support from,Andrew Wakefield,according to CNN Money
85,Generation Rescue,headed by,Jenny McCarthy,
86,Generation Rescue,started by,Lisa and J.B. Handley,
87,high-dose flu vaccine,is appropriate for,age 65 and older,says CDC
88,high-dose flu vaccine,is more effective for those,age 85 and older,says new VA study
89,high-dose flu vaccine,jury is still out on whether the high does truly does a better job of preventing major flu impacts like death of,elderly,from institutional and public health perspective
90,high-dose flu vaccine,studies yield mixed findings for,elderly,
91,high-dose flu vaccine,jury is still out on whether the high does truly does a better job of preventing major flu impacts like hospitalization of,elderly,from institutional and public health perspective
92,high-dose flu vaccine,triggered stronger,immune response,says Sanofi Pasteur
93,high-dose flu vaccine,provided better protection against lab-confirmed,influenza,
94,high-dose flu vaccine,the jury is still out on whether the high dose truly does a better job of preventing,major flu impacts,from institutional and public health perspective
95,high-dose flu vaccine,provided better protection against lab-confirmed flu illness than did the,standard vaccine,says Sanofi Pasteur
96,high-dose flu vaccine,data suggests does a better job of preventing,symptomatic flu infections,
97,Immunization Action Coalition,works closely with,CDC,
98,immunization waivers,kindergarteners have because of parents',personal belief,
99,immunizations,have reduced by 80%,pertussis cases,"since the pre-vaccine era, Dr. Anna Acosta said"
100,immunized person,"if immunized person gets sick, disease will be less severe",disease,
101,increase in cases,could result in,infant mortality,infant deaths
102,infants,"should receive their own doses at 2, 4, 6 months of age",vaccines,
103,kindergarteners,"more than 13,500 have",immunization waviers,because of parents' personal beliefs
104,kindergarteners,have immunization waivers because of parental,personal belief,
105,maternal inoculation,will protect,infants,
106,measles outbreak,rekindled movement,anti-vaccination,
107,medical science,says the evidence is clear,measles vaccine is safe,
108,medical science,says the evidence is clear,rubella vaccination is safe,
109,medical science,says the evidence is clear,pertussis vaccine is safe,
110,mixed findings,studies yield for,high-dose flu vaccine,
111,MMR vaccine,many studies have refuted the connection between,autism,according to the Immunization Action Coalition
112,National Vaccine Information Center,"through billboards, the giant Jumbotron display in Times Square, and a film on Delta's DAL in-flight video network promotes",vaccine concerns,
113,negative perception,is associated with,anti-vaccination,said Renee Gentry
114,negative perception,associated with anti-vaccine movement has made it difficult to have,open conversations,about real risks associated with vaccines
115,open conversations,are difficult to have about,vaccine risks,said Renee Gentry
116,parents,worried SB 277 would deprive young people of right to an,education,
117,parents,if they decide against immunization can,home-school,
118,parents,can home-school if they decide against,immunization,
119,parents,more than 100 protested,SB 277,
120,parents,worried,SB 277,would deprive young people of right to an education
121,parents,many testified against proposal for,SB 277,
122,parents,said they didn't believe in,vaccine safety,
123,parents with vaccine-injured children,are afraid of being labeled as the,anti-vaxxers,
124,parents with vaccine-injured children,are afraid of being labeled as the,crazy people,
125,parents with vaccine-injured children,lie to,friends and family,
126,parents with vaccine-injured children,lie about,vaccine-injured children,
127,people,lose their minds if you say you have,vaccine allergy,said Renee Gentry
128,people who refuse vaccination,clusters may have rise in,disease,says Gambhir
129,personal belief exemption,is,parental choice,parents' option
130,pertussis,can impede,breathing,
131,pertussis,characterized by,severe coughing,
132,pertussis,interferes with,sleep,
133,pertussis,is highest since 1955 in,United States,highest since 1955
134,pertussis,in the past decade is on the rise in the,United States,
135,pertussis,can cause,vomiting,
136,pertussis,is,whooping cough,
137,pertussis booster shot,over time,decreasing effectiveness,
138,pertussis booster shot,is given to,preteens,
139,pertussis cases,have sprialled upward in the past decade,Australia,says co-author Associate Professor Manoj Gambhir
140,pertussis cases,"according to CDC 48,000 cases in U.S. in 2012, the most since 1955, even with high",vaccine coverage,for childhood and preteen
141,pertussis in infants,face notably high risk for,death,
142,pertussis in infants,face notably,high-risk,
143,pertussis in infants,face notably high risk for,severe disease,
144,pertussis increase,recent in,Americans,
145,pertussis increase,attributed to  Tdap,waning effectiveness,"similar findings emerged from Wisconsin study, leading the CDC to attribute"
146,pertussis vaccine,sixth dose has been recommended since 2005 for,adolescents,
147,pertussis vaccine,linked to increase in U.S.,cases,
148,pertussis vaccine,improved vaccine is needed says,CDC,
149,pertussis vaccine,current schedule of vaccinations and further booster doses may require,changes,according to Gambhir
150,pertussis vaccine,had concerns about,vaccine duration,
151,pertussis vaccine,is initially effective with 73%,effectiveness,said Dr. Anna Acosta
152,pertussis vaccine,after 2-4 years falls to 34%,effectiveness,said Dr. Anna Acosta
153,pertussis vaccine,modification may have also contributed to the recent,pertussis increase,
154,pertussis vaccine,was developed to address public concerns,vaccine reaction,
155,PLOS Computational Biology,published a paper that found level of protection is lower from new,acellular pertussis vaccine,
156,polarized area,has,Jenny McCarthy,
157,polarized area,has,side of right and good,or you're Jenny McCarthy
158,politicians,"as the U.S. sees a measles flare-up, some seem to jump on the bandwagon",anti-vaccination,Washington Post reports
159,pregnant women,during their third trimester should continue to get,pertussis vaccine,Acosta stressed
160,proposed restrictions,introduced partly in response to,Disneyland measles outbreak,
161,protection,lower level with,acellular pertussis vaccine,Gambhir research finds
162,protested,that SB 277 would deprive young people of,public education,by parents
163,Rand Paul,expected to run for 2016,president,
164,Rand Paul,is,Republican,
165,Rand Paul,said that most,vaccines should be voluntary,KY Senator
166,Renee Gentry,is president of,Vaccine Injured Petitioners Bar Association,
167,Richard Pan,altered SB 277 to make it possible for multiple families to join in,home-school,
168,Richard Pan,altered SB 277 with,proposed restrictions,to make it possible for multiple families to join in home-schooling unvaccinated children
169,risk of complications,is lower but still significant for,pertussis in adults,
170,risk of complications,is lower but still significant for,pertussis in teens,
171,Saron Runner,voted against,SB 277,
172,SB 277,removes vaccine exemptions in,California,
173,SB 277,authors agreed to,changes,
174,SB 277,opponents packed,committee hearing room,
175,SB 277,would deprive young people of right to,education,
176,SB 277,change added,vaccination exemption,for students enrolled in independent study program run by public school system
177,SB 277,has struck,fair balance,thinks Ben Allen
178,SB 277,changes make it easier for parents to,home-school,
179,SB 277,will not help those who can't,home-school,
180,SB 277,will not help,low-income family,
181,SB 277,changes make it easier for,parents,
182,SB 277,would eliminate,personal belief exemption,
183,SB 277,altered with,proposed restrictions,
184,SB 277,opponents many said would continue,protest,
185,SB 277,would deprive young people of,public education,
186,SB 277,won't,reach everyone,Ben Allen told education committee
187,SB 277,will increase everyone's safety against,infectious disease,Ben Allen told education committee
188,SB 277,passed by key,Senate committee,
189,SB 277,cleared,Senate Education Committee,on bipartisan vote
190,SB 277,approved by key,Senate panel,
191,SB 277,will not help,single working parent,
192,SB 277,would require more,vaccinated children,in California
193,SB 277,removes,vaccination exemption,in California
194,side effects,difference in risk between standard flu vaccine and high-dose flu vaccine is very,minimal,
195,side effects,are rare,vaccines,
196,standard flu vaccine,is appropriate for,age 65 and older,says CDC
197,standard flu vaccine,works just as well for those,ages 65-84,published in journal Clinical Infectious Diseases
198,state-required vaccinations,on grounds of,personal belief,
199,Tdap,was added to vaccine protocal because of concerns about,vaccine duration,for ages 11 and 12 and adults who never got Tdap; in 2005
200,Tina Kimmel,is former,scientist,with CA Department of Public Health
201,Tina Kimmel,is shocked and disappointed about,SB 277,
202,University of British Columbia,research looking at potential,vaccine-autism link,link between aluminum in vaccines and neurological disorders
203,upward trend,despite low number of,cases,says Gambhir
204,upward trend,despite low number of,cases,says Professor Neil Ferguson
205,upward trend,even though there are currently low number of,pertussis cases,whooping cough
206,vaccinated children,more required before entering,school,
207,vaccination,impact has taken time to show change in,data,
208,vaccination,have decreased whooping cough disease incidence in the,United States,in mid 1970s
209,vaccination exemption,added to SB 277 for,students enrolled in independent study program,run by public school system
210,vaccine debate,often spearheaded by,celebrities,
211,vaccine debate,often spearheaded by,nonprofit organizations,
212,vaccine debate,is,polarized area,said Renee Gentry
213,vaccine debate,funding comes from a number of,wealthy family foundations,
214,vaccine efficacy,is still high,acelluar vaccine,
215,vaccine efficacy,drop significant of acellular vaccine when compared to,whole-cell vaccine,according to Gambhir
216,vaccine refusal,may have caused rise in,disease,in small clusters says Gambhir
217,vaccine refusal,clusters cannot account for generalised rise in,disease,Gambhir says
218,vaccine risk,are far lower than the potential for permanent damage or death caused by,vaccine-preventable diseases,
219,vaccines,cause various,childhood illnesses,
220,vaccines,cause,cognitive disorders,
221,vaccines,are very,effective,said Renee Gentry
222,vaccines,are,for-profit,said Renee Gentry
223,vaccines,cause,immune disorders,
224,vaccines,cause,inflammatory disorders,
225,vaccines,are not,magic,said Renee Gentry
226,vaccines,are,man-made,said Renee Gentry
227,vaccines,are not,miracles,said Renee Gentry
228,vaccines,are incredibly,necessary,said Renee Gentry
229,vaccines,are,not perfect,stressed Dr. Anna Acosta
230,vaccines,are not magic,Pez dispensers,said Renee Gentry
231,vaccines,"are very effective, incredibly necessary, man-made, for-profit",pharmaceuticals,"very effective, incredibly necessary, man-made, for profit"
232,vaccines,should be treated as,pharmaceuticals,"very effective, incredibly necessary, man-made, for profit"
233,vaccines,among children and adolescents are still best way to provide,protection,stressed Dr. Anna Acosta
234,waning immunity,may be an issue in new series of,pertussis vaccine,
235,whole-cell vaccine,caused reactions in some,children,
236,whole-cell vaccine,was very,effective,says Gambhir
237,whooping cough,is,pertussis,
238,young people,would be deprived of,public education,