index,source,edge,target,edge-comments
352,parents of children with ASD,are more likely,delaying vaccinations,Dr. Bryan King said research has shown
353,delaying vaccinations,puts at risk of potentially serious infections,children,said Dr. Anjali Jain
354,health officials,blame,parents who choose to delay vaccination,for disease reappearance
355,measles reappearance,health officials blame in part on,parents who choose to delay vaccination,
356,United States,in recent years has seen a rising rate of,ASD,
357,child,one in 68 kids has some form of,ASD,according to latest federal estimates
358,genes,it is known that genes make certain children more vulnerable to,autism,
359,children with affected older sibling,are at higher-than-average risk,autism risk,increased risk
360,environmental factors,also have to play a role,autism,
361,ASD,range widely in,severity,
362,children with ASD,some have mild,problems with social interactions,
363,children with ASD,some are,unable to speak,
364,children with ASD,some focus on limited number of,repetitive behaviors,
365,children,some have,genetic predisposition,
366,genetic predisposition,makes more vulnerable to,autism,
367,environmental factors,must play a,role,experts believe
368,theory,of autism is,triple hit,said Dr. Bryan King
369,triple hit,includes,genetic predisposition,
370,triple hit,includes,environmental trigger,
371,environmental trigger,strikes during particular window in,brain development,
372,MMR vaccine,is not that,environmental trigger,say health experts
373,MMR vaccine,no evidence that it raised,autism risk,in either group of children
374,children with affected older sibling,no evidence that MMR vaccine raised,autism risk,
375,children without affected older sibling,no evidence that MMR vaccine raised,autism risk,
376,children with affected older sibling and who had received MMR vaccine,were actually one-quarter less likely to be diagnosed with,ASD,one dose by age 2
377,MMR vaccine,is probably not protective against,autism,said Dr. Bryan King
378,vaccination,was not associated with an increased risk in children with or without an affected,sibling,
379,environmental factors,we don't understand those contributing to the exponential rise in,ASD,
380,prenatal development,is,critical period,researchers suspect
381,autism risk,"among more than 322,000 children was elevated among children who had",mothers with pregnancy-related diabetes,researchers found
382,autism-linked genes,some are also involved in regulating,insulin,
383,children with affected older sibling,7% themselves had,ASD,compared with 1% of children without affected older sibling
384,parents who noticed developmental delays,may have,opted-out of vaccination,
385,GlaxoSmithKline,recalling remaining doses of,2014-2015 FLULAVAL QUADRIVALENT flu vaccine,
386,GlaxoSmithKline,voluntarily initiated,flu vaccine recall,
387,2014-2015 FLULAVAL QUADRIVALENT flu vaccine,potentially may have,reduced effectiveness,
388,2014-2015 FLULAVAL QUADRIVALENT flu vaccine,detected decrease in,vaccine potency,
389,vaccine potency,fell below pre-specified limit prior to expiration of,2014-2015 FLULAVAL QUADRIVALENT flu vaccine,
390,2014-2015 FLULAVAL QUADRIVALENT flu vaccine,reduced potency does not pose,safety concern,
391,2014-2015 FLULAVAL QUADRIVALENT flu vaccine,is quadrivalent flu vaccine that protects against,influenza viruses,
392,GSK flu vaccine recall,means the vaccine no longer meets the manufacturer's specifications for potency for these particular viruses because of,reduced vaccine potency,
393,reduced vaccine potency,does not necessarily mean people vaccinated received,reduced benefit,
394,CDC,does not recommend revaccination for people who received the recalled,2014-2015 FLULAVAL QUADRIVALENT flu vaccine,
395,vaccinated people,may be,revaccinated,of 2014-2015 FLULAVAL QUADRIVALENT flu vaccine
396,Northern Hemisphere flu vaccine,approved for use in the United States might provide,suboptimal protection,against flu viruses expected to circulate in the Southern Hemisphere
397,HPV vaccine,is effective against,infection at multiple sites,
398,HPV vaccine,provides,partial protection,
399,HPV vaccine,provides partial protection for,women previously exposed to HPV,
400,HPV vaccine,provides partial protection against,high-risk types of HPV,
401,partial protection,provided for,women previously exposed to HPV,
402,young women,protected from,high-risk types of HPV,
403,infection of cervix,is,high-risk types of HPV,
404,infection of anus,is,high-risk types of HPV,
405,infection of mouth,is,high-risk types of HPV,
406,infection of cervix,is primary anatomic site where persistent HPV infections can cause,cancer,
407,infection of anus,is primary anatomic site where persistent HPV infections can cause,cancer,
408,infection of mouth,is primary anatomic site where persistent HPV infections can cause,cancer,
409,multi-site protection,"also observed, though at lower levels, in",women previously exposed to HPV,
410,HPV Vaccine Trial in Costa Rica,previous reports looking at separate sites demonstrated high,vaccine efficacy,
411,HPV Vaccine Trial in Costa Rica,previous reports looking at separate sites demonstrated HPV vaccine is highly effective in providing,multi-site protection,
412,multi-site protection,includes,infection of cervix,
413,multi-site protection,includes,infection of anus,
414,multi-site protection,includes,infection of mouth,
415,HPV Vaccine Trial in Costa Rica,is first to analyze,multi-site protection,"explained Daniel C. Beachler, postdoctoral fellow at NCI"
416,HPV vaccine,brought,reduction in HPV,"of cervix, anus, and mouth"
417,HPV vaccine,brought greatest protection,women without previous HPV,reported Daniel C. Bleacher
418,vaccine efficacy,was lower for,women previously exposed to HPV,
419,HPV vaccine,cannot help clear,current HPV infection,stressed Daniel C. Bleacher
420,HPV vaccine,may provide partial protection at multiple sites in,women previously exposed to HPV,said Daniel C. Bleacher
421,HPV Vaccine Trial in Costa Rica,findings support current,HPV vaccine recommendations,said Daniel C. Bleacher
422,HPV vaccine recommendations,start at,age 11 or 12,
423,HPV vaccine recommendations,are to continue through,age 26,
424,Gardasil,recently approved and protects against seven,cancer-causing types of HPV,
425,MMR vaccines,massive study finds no link to,autism spectrum disorders,
426,JAMA paper,"study of 95,000 children finds no",MMR vaccine-autism link,
427,MMR vaccine-autism link,it seems silly that this is still,argument,
428,vaccines,do not cause,autism,
429,public health organizations,agree that,vaccines do not cause autism,
430,Federal Circuit,agree that,vaccines do not cause autism,
431,The Lancet,agree that,vaccines do not cause autism,
432,JAMA paper,should end once and for all,vaccine debate,
433,MMR vaccine,researchers were unable to find any association with,autism,
434,children with family history of autism,researchers found no association for,MMR vaccine-autism link,
435,scientific paper,there has never been a single high-quality to suggest,MMR vaccine-autism link,
436,studies,numerous have found,vaccines are safe,over past 15 years
437,studies,numerous have found,vaccines are effective,
438,Institute of Medicine,examined large body of epidemiological evidence and confirmed in 2004 that,MMR vaccine does not cause autism,
439,Institute of Medicine,in 2011 reviewed another eight major vaccines and found that,vaccines do not cause autism,
440,CDC,in 2013 tracked 256 children with autism and investigated whether they had received the MMR vaccine and found,MMR vaccine does not cause autism,
441,studies,from several countries proved that,thimerosal is safe,
442,Disneyland measles outbreak,was caused by,unvaccinated children,id
443,MMR vaccine,doesn't cause,autism,
444,MMR vaccine,may lower,autism risk,
445,Wakefield study,had,ill effects,
446,vast amounts of time,spent to counter,ill effects,of Wakefield study
447,vast amounts of money,spent to counter,ill effects,of Wakefield study
448,Wakefield study,claimed to find,MMR vaccine-autism link,
449,vaccines,many parents continue to withhold from,children,because of fear of vaccine-autism link
450,children,many continue to withhold vaccines because of,fear of vaccine-autism link,
451,parents,have fear of,vaccine-autism link,
452,parents,have,fear of vaccine-autism link,
453,fear,parents have that there is,vaccine-autism link,
454,evidence,contradicts,vaccine-autism link,
455,vaccines,have,saved lives,millions
456,vaccines,are probably of past two centuries the greatest,medical advancement,
457,Jain study,adds more weight to evidence about,MMR vaccine safety,
458,Jain study,did not have,suprising results,for those who have followed the science
459,Jain study,shows receipt of,MMR vaccine,not associated with increased ASD risk
460,MMR vaccine,was not associated with increased,ASD risk,Jain study
461,ASD risk,did not increase even in,younger siblings of children with ASD,
462,Jain study,indicates no,harmful association,between MMR vaccine receipt and ASD
463,harmful association,none between,MMR vaccine and ASD,
464,MMR vaccine,no harmful association with,ASD,
465,harmful association,none even for,high-risk children,children at higher risk for ASD
466,previous studies,have already settled,vaccine-autism question,
467,Jain study,should settle,vaccine-autism question,
468,vaccines,cause,autism,is misguided claims
469,vaccines,cause,neurological problems,is misguided claims
470,misguided claims,persist that,vaccines cause autism,
471,misguided claims,persist that,vaccines cause neurological problems,
472,misguided claims,persist thanks to ongoing,activism,
473,activism,ongoing of,anti-vaccine groups,
474,misguided claims,persist thanks to ongoing activism of,anti-vaccine groups,
475,Age of Autism,is such,anti-vaccine groups,
476,Age of Autism,already attacked,Jain study,
477,misguided claims,persist thanks to,conspiracy theories,
478,conspiracy theories,such as,"Robert F. Kennedy, Jr.",
479,"Robert F. Kennedy, Jr.",was campaigning against,vaccines,in Vermont
480,vaccines,unethical to withhold on purpose from,children,
481,withholding vaccines,on purpose is unethical from,children,
482,withholding vaccines,on purpose from children is,unethical,
483,Jain study,was by necessity,observational study,
484,vaccinated children,are somewhat less likely to be diagnosed with autism than unvaccinated children indicated findings of,Jain study,
485,vaccinated children,are somewhat less likely to be diagnosed with,autism,than unvaccinated children
486,vaccinated children,less likely to be diagnosed with autism than,unvaccinated children,indicated findings of Jain study
487,Jain study,indicated statistically significant finding that they are less likely to be diagnosed with autism than unvaccinated high-risk children,vaccinated high-risk children,
488,vaccinated high-risk children,are less likely to be diagnosed with,autism,than unvaccinated high-risk children
489,vaccinated high-risk children,are less likely to be diagnosed with autism than,unvaccinated high-risk children,indicated findings of Jain study
490,Jain study,findings indicated,protective effect of vaccines,from autism
491,protective effect of vaccines,may protect children from,autism,
492,other good reasons,Jain study authors noted for apparent,protective effect of vaccines,
493,parents of autistic children,could explain apparent,protective effect of vaccines,
494,parents of autistic children,could explain apparent protective effect of vaccines by,withholding vaccines,
495,protective effect of vaccines,may be explained by parents of autistic children,withholding vaccines,
496,autism,is known to have,genetic component,
497,younger sibling of child with autism,more likely to have,autism,because they share many genes
498,parents of autistic children,withheld vaccines because of fears spread by,anti-vaccine movement,
499,parents of autistic children,who withheld vaccines from their children could contribute to the apparently lower,lower rate of autism in vaccinated children,
500,protective effect of vaccines,was shown by,lower rate of autism in vaccinated children,in Jain study
501,Jain study,authors couldn't rule out,protective effect of vaccines,
502,protective effect of vaccines,is scientifically,unlikely,
503,alternative explanation,Jain study authors wisely offered for,protective effect of vaccines,
504,Jain study,is,large study,
505,Jain study,is,carefully conducted study,
506,Jain study,shows,MMR vaccine does not cause autism,
507,Jain study,hope helps to,end the anti-vax movement,
508,anti-vax movement,is spending time and money trying to refute,long-discredited hypotheses,
509,we,want to,end the anti-vax movement,
510,long-discredited hypotheses,of anti-vax movement include,MMR vaccine-autism link,
511,anti-vax movement,should stop spending,time,
512,anti-vax movement,should stop spending,money,
513,we,want to focus on trying to understand the,true cause of autism,
514,MMR vaccine,no link between,autism,
515,MMR vaccine and autism,has no,link,
516,MMR vaccine and autism,no link even in,high risk children,
517,high risk children,have,siblings with autism,
518,measles outbreak,affected 14,states,
519,measles outbreak,began in,California,
520,California,where belief is widespread that,vaccines cause autism,
521,vaccines,can cause,autism,
522,JAMA study,is in,Journal of the American Medical Association,
523,JAMA study,"examined insurance claims for 96,000",U.S. children,
524,JAMA study,examined,insurance claims,
525,JAMA study,"examined insurance claims for 96,000 U.S. children born 2001-2007 to look for",MMR vaccine and autism link,
526,lawmakers,in California and elsewhere are increasingly proposing strengthened,vaccination requirements,
527,anti-vaxxer,is,anti-vaccine,
528,anti-vaxxer,has considerable,commitment,
529,anti-vaxxer,has,true-believer cohort,
530,anti-vaxxer,is an effective,opponent of sanity-oriented legislation,of sanity-oriented legislation
531,opponent of sanity-oriented legislation,anti-vaxxer is effective despite,minority views,
532,anti-vaxxer,has,minority views,
533,teen,make sure they get,meningococcal vaccine,
534,meningococcal vaccine,protects against,meningococcal disease,
535,meningococcal disease,very serious and not very common,illness,in the United States
536,meningococcal disease,can be devastating and often and unexpectedly strikes otherwise,healthy people,
537,preteens,should get the first dose at their 11-12 year old check-up,meningococcal vaccine,
538,meningococcal conjugate vaccine,is,safe,
539,side effects,occur from,meningococcal vaccine,
540,side effects,most are mild and moderate,meningococcal vaccine,
541,side effects,do not affect daily activities,meningococcal vaccine,
542,early diagnosis,very important for,meningococcal disease,
543,early treatment,very important for,meningococcal disease,
544,meningococcal disease,spread from person to person by sharing,respiratory secretions,"(such as saliva, by kissing or coughing), during close or lengthy contact"
545,meningococcal disease,spread especially among people who share a room or live in the same,household,
546,teens,are at increased risk for ,meningococcal disease,
547,young adults,are at increased risk for ,meningococcal disease,
548,meningococcal disease,people can be,carrier,
549,carriers,of meningococcal disease do not have any,symptoms,
550,meningococcal disease,most cases appear to be random and aren't linked to other,cases,
551,close contacts,of a person with meningococcal disease should receive,prophylaxis,
552,meningococcal disease,very few cases occur as part of an,outbreak,
553,preteens,need,meningococcal vaccine,
554,teens,need,meningococcal vaccine,
555,meningococcal vaccine,protects against,meningococcal disease,
556,meningococcal disease,is a very,serious illness,
557,death,in as little as a few hours can occur,meningococcal disease,
558,meningococcal conjugate vaccine,recommended at,11-12 years of age,
559,meningococcal conjugate vaccine booster dose,recommended at,16 years of age,
560,vaccines,help prevent against most common,serogroups of meningococcal disease,
561,meningococcal vaccine,recommended for all,preteens,
562,meningococcal vaccine,recommended for all,teens,
563,meningococcal vaccine,routinely recommended for all,11-18 year olds,
564,teenagers,recommended to get,booster dose,
565,meningococcal vaccine,protects against,serogroup C,
566,meningococcal vaccine,protects against,serogroup Y,
567,meningococcal vaccine,does not protect against,serogroup B,
568,side effects,do occur with,meningococcal vaccine,
569,side effects,most are,mild,
570,side effects,most do not affect,daily activities,
571,side effects,most common take place in,arm,
572,arm side effects,can include,pain,
573,arm side effects,can include,tenderness,
574,arm side effects,can include,swelling,
575,arm side effects,can include,hardness of the skin,
576,common side effects,include,nausea,
577,common side effects,include,run down feeling,
578,common side effects,include,headache,
579,reactions,usually last,short amount of time,
580,risk of fainting,after getting,meningococcal vaccine,
581,risk of fainting,after getting any,any shot,
582,meningococcal disease,refers to any illness caused by,Neisseria meningitidis bacteria,
583,meningococcal disease,can be treated with,effective antibiotics,
584,death,10 to 15 out of 100 people,meningococcal disease,10 to 15 out of 100 people
585,meningococcal disease,11 to 19 out of every 100 survivors will have,long-term disabilities,11 to 19 out of every 100 survivors
586,long-term disabilities,such as,loss of limb,
587,long-term disabilities,such as,deafness,
588,long-term disabilities,such as,nervous system problems,
589,long-term disabilities,such as,brain damage,
590,Neisseria meningitidis bacteria,spread by sharing,respiratory secretions,
591,anyone,can get,meningococcal disease,
592,teens,at increased risk for,meningococcal disease,
593,young adults,at increased risk for,meningococcal disease,
594,people,can carry without getting sick,Neisseria meningitidis bacteria,without getting sick
595,carrier,does not have,meningococcal disease symptoms,
596,bacteria,most often spread by,carriers,
597,meningococcal disease,97 or 98 out of 100 cases appear to be,random cases,
598,meningococcal disease cases,most aren't linked to,other meningococcal disease cases,
599,close contacts,highest risk for getting,infection,
600,close contacts,should receive,antibiotics,
601,antibiotics,prevent from getting,meningococcal disease,
602,meningococcal outbreak,can occur in,communities,
603,meningococcal outbreak,can occur in,schools,
604,meningococcal outbreak,can occur in,colleges,
605,meningococcal outbreak,can occur in,prisons,
606,meningococcal outbreak,can occur in,other populations,
607,meningococcal disease cases,very few (2 or 3 out of 100) occur as part of,meningococcal outbreak,
608,meningococcal disease symptoms,may include sudden onset of,high fever,
609,meningococcal disease symptoms,may include sudden onset of,headache,
610,meningococcal disease symptoms,may include sudden onset of,stiff neck,
611,meningococcal disease symptoms,can start similar to,influenza symptoms,
612,meningococcal disease,will often cause,nausea,
613,meningococcal disease,will often cause,vomiting,
614,meningococcal disease,will often cause,increased sensitivity to light,
615,meningococcal disease,will often cause,rash,
616,meningococcal disease,will often cause,confusion,
617,MMR vaccine-autism link,no evidence even in,children at higher risk for autism,
618,MMR vaccine-autism link,even in children at higher risk for autism,no evidence,
619,autism spectrum disorder,study after study found no link with,MMR vaccine,
620,autism spectrum disorder,study after study found no link with,vaccine,any vaccine
621,parents,many for young children,refuse vaccinations,
622,parents,many for young children,delay vaccinations,
623,parents,refuse based on,misplaced fear of ASD,
624,parents,delay based on,misplaced fear of ASD,
625,misplaced fear of ASD,can be traced back to,Wakefield study,
626,Wakefield study,is,debunked study,
627,vaccine refusal,can have major negative impact on,public health,
628,vaccine delay,can have major negative impact on,public health,
629,decline in vaccination rates,have also seen,resurgence of measles,
630,decline in vaccination rates,have also seen,resurgence in potentially fatal childhood infectious diseases,
631,measles,is,potentially fatal childhood infectious disease,
632,parents of child with ASD,among most likely for,vaccine avoidance,
633,researchers,once again found no,MMR vaccine-ASD link,
634,MMR vaccine-ASD link,not among,children at higher risk for autism,
635,children at higher risk for autism,have,sibling with ASD,
636,ASD rate,higher among,children at higher risk for autism,
637,ASD risk,did not increase with receipt of,MMR vaccine,for children at higher risk of ASD
638,children at higher risk for autism,actually less likely to receive,autism diagnosis,if received vaccination
639,California,had distressing,resurgence of measles,
640,parents,critical they protect their children against,measles,
641,parents,critical they protect their children against,infectious disease,
642,measles,protect against by staying current with,vaccinations,
643,infectious diseases,protect against by staying current with,vaccinations,
644,not vaccinating children,has,serious consequences,
645,United States,688 people in 27 states in 2014 contracted,measles,
646,measles,can lead to,ear infections,
647,measles,can lead to,pneumonia,
648,measles,can lead to,seizures,
649,measles,can lead to,brain damage,
650,measles,can lead to,death,
651,parental responsibility,to,children,
652,parental responsibility,to,community,
653,population immunity,high level required to,prevent outbreaks,
654,population immunity,high level important for,children with cancer,
655,population immunity,high level important for,children with immunosuppressive diseases,
656,children with cancer,cannot receive,vaccinations,
657,children with immunosuppressive diseases,cannot receive,vaccinations,
658,children with cancer,depend on,herd immunity,
659,children with immunosuppressive diseases,depend on,herd immunity,
660,herd immunity,provides protection against,potentially fatal infection,
661,ASD,remains,challenge,
662,ASD,remains challenge for,scientists,
663,ASD,remains challenge for,families,
664,NIH and partners,large effort to understand,genetic risk factors for ASD,
665,NIH and partners,large effort to understand,environmental risk factors for ASD,
666,NIH and partners,large effort to develop more effective,pharmacological interventions,for children with ASD
667,NIH and partners,large effort to develop more effective,behavioral interventions,for children with ASD
668,scientists,crack a 50-year old,mystery,about the measles vaccine
669,measles vaccine,was 50-year old,mystery,
670,children,United States started vaccinating in 1960s for,measles,
671,children,stopped getting,measles,as expected after measles vaccine
672,childhood deaths,plummeted for,infectious diseases,after measles vaccine
673,diarrhea deaths,cut in half after,measles vaccine,
674,pneumonia deaths,cut in half after,measles vaccine,
675,scientists,saw same phenomenon of,measles vaccine,in England and in parts of Europe
676,measles vaccine,phenomenon today is seen in,developing countries,scientists see
677,Michael Mina,is postdoc in biology at,Princeton University,
678,Michael Mina,is,medical student,at Emory University
679,reduction in mortality,up to 80% in,developing countries,says Michael Mina
680,reduction in mortality,occurred after the introduction of,measles vaccine,
681,infectious diseases,are very high in,developing countries,
682,mortality rate decrease,following introduction of measles vaccine is,mystery,
683,children,who get measles vaccine are more likely to get,better health care,
684,children,are more likely to get better health care who receive,measles vaccine,
685,better health care,includes more,antibiotics,
686,better health care,includes other,vaccines,
687,United States,has seen since 1960s,health care improvement,
688,Mina team,used,epidemiological data,"from United States, Denmarck, Wales, and Englad dating back to 1940s"
689,Mina team,used,computer models,
690,measles cases,number predicted two to three years later,number of deaths from other infections,
691,measles virus,predisposes to other infectious diseases for up to a few years,children,says Michael Mina
692,measles,is known to suppress,immune system,for a few weeks after infection
693,measles,erases,immune protection,to other diseases
694,previous monkey studies show,measles erases,immune protection,says Michael Mina
695,immune system,after measles seems to have,immune amnesia,
696,immune system,has to start over after infection with,measles,
697,immune system,after measles infection has to rebuild its immune protection against,prior diseases,
698,immune system,after measles infection has to rebuild its,immune protection,against prior diseases
699,immune amnesia,is still just a,hypothesis,says William Moss
700,immune amnesia,needs more,testing,says William Moss
701,William Moss,is,epidemiologist,
702,William Moss,has studied for more than a decade,measles vaccine,
703,William Moss,is at,Johns Hopkins University,
704,Mina study,provides compelling evidence says,William Moss,provides compelling evidence1
705,Mina study,provides compelling,evidence,says William Moss
706,evidence,in Mina study is that measles affects,immune system,for two to three years
